{
  "activity_id": 2,
  "activity_name": "Logoff",
  "auth_protocol_id": 0,
  "category_name": "Identity \u0026 Access Management",
  "category_uid": 3,
  "class_name": "Authentication",
  "class_uid": 3002,
  "metadata": {
    "log_name": "json",
    "product": {
      "name": "LogGate",
      "vendor_name": "LogGate"
    },
    "version": "1.3.0"
  },
  "severity": "Informational",
  "severity_id": 1,
  "src_endpoint": {
    "ip": "192.0.2.34"
  },
  "status": "Success",
  "status_id": 1,
  "time": 1760666400000,
  "type_name": "Authentication: Logoff",
  "type_uid": 300202,
  "user": {
    "name": "carol"
  }
}
