{
  "activity_id": 0,
  "activity_name": "Unknown",
  "category_name": "Uncategorized",
  "category_uid": 0,
  "class_name": "Base Event",
  "class_uid": 0,
  "metadata": {
    "log_name": "text",
    "product": {
      "name": "LogGate",
      "vendor_name": "LogGate"
    },
    "version": "1.3.0"
  },
  "raw_data": "Oct 17 10:00:07 bastion kernel: eth0: link up",
  "severity": "Unknown",
  "severity_id": 0,
  "time": 1792204200000,
  "type_name": "Base Event: Unknown",
  "type_uid": 0
}
