{
  "activity_id": 1,
  "activity_name": "Logon",
  "auth_protocol_id": 0,
  "category_name": "Identity \u0026 Access Management",
  "category_uid": 3,
  "class_name": "Authentication",
  "class_uid": 3002,
  "metadata": {
    "log_name": "sshd",
    "product": {
      "name": "LogGate",
      "vendor_name": "LogGate"
    },
    "version": "1.3.0"
  },
  "raw_data": "Oct 17 10:00:04 bastion sshd[2214]: Connection closed by authenticating user root 203.0.113.5 port 3334 [preauth]",
  "severity": "Low",
  "severity_id": 2,
  "src_endpoint": {
    "ip": "203.0.113.5",
    "port": 3334
  },
  "status": "Failure",
  "status_detail": "connection closed before authentication",
  "status_id": 2,
  "time": 1792204200000,
  "type_name": "Authentication: Logon",
  "type_uid": 300201,
  "user": {
    "name": "root"
  }
}
