{
  "activity_id": 1,
  "activity_name": "Logon",
  "auth_protocol": "ssh2/password",
  "auth_protocol_id": 99,
  "category_name": "Identity \u0026 Access Management",
  "category_uid": 3,
  "class_name": "Authentication",
  "class_uid": 3002,
  "metadata": {
    "log_name": "sshd",
    "product": {
      "name": "LogGate",
      "vendor_name": "LogGate"
    },
    "version": "1.3.0"
  },
  "raw_data": "Oct 17 10:00:01 bastion sshd[2211]: Accepted password for alice from 192.0.2.10 port 51122 ssh2",
  "severity": "Informational",
  "severity_id": 1,
  "src_endpoint": {
    "ip": "192.0.2.10",
    "port": 51122
  },
  "status": "Success",
  "status_id": 1,
  "time": 1792204200000,
  "type_name": "Authentication: Logon",
  "type_uid": 300201,
  "user": {
    "name": "alice"
  }
}
